{
  "schemaVersion": "grant-merkle-root-v1",
  "network": "Base Sepolia",
  "generatedAt": "2026-03-05T02:13:09.553Z",
  "registry": {
    "path": "manifests/grants/registry.json",
    "sha256": "0x7499f3b9412b8f42e291671a5c0b2f89d5d22c0595b02a298fd2d99fa0ff5fef"
  },
  "leafEncoding": {
    "type": "utf8-pipe-delimited",
    "delimiter": "|",
    "normalization": {
      "addresses": "lowercase",
      "numbers": "base10-integers"
    }
  },
  "leafFields": [
    "grantId",
    "beneficiary",
    "vestingContract",
    "totalAmount",
    "start",
    "cliff",
    "duration",
    "status"
  ],
  "leafOrder": {
    "sortBy": "grantId",
    "direction": "asc"
  },
  "leafHashes": [
    {
      "grantId": "0xfe7e692a333e5b9e81a2a664d4b946b1128bb55d2a73d2e3055d91906415467a",
      "leafHash": "0x2fbcda8966bb426d2aafbf8523f84b4268273a23c83ed810988c74b5a7c86e65"
    }
  ],
  "merkleRoot": "0x2fbcda8966bb426d2aafbf8523f84b4268273a23c83ed810988c74b5a7c86e65",
  "notes": "Leaf hash = sha256(utf8(grantId|beneficiary|vestingContract|totalAmount|start|cliff|duration|status)). Merkle node = sha256(left||right). Odd nodes duplicate last."
}
